{
  "schema_version": "1.0",
  "exam": "Bachillerato por Madurez Suficiente — Matemáticas",
  "convocatoria": "02-2026",
  "language": "es-CR",
  "source": "Práctica BXM Matemáticas 02-2026",
  "specification": "Tabla de especificaciones MATEMÁTICAS — Bachillerato por Madurez Suficiente, convocatoria 02-2026",
  "solucionario_verified": true,
  "total_items": 60,
  "sections": [
    {
      "id": "geometry",
      "name": "Geometría",
      "item_range": [
        1,
        23
      ],
      "total_items": 23
    },
    {
      "id": "functions",
      "name": "Relaciones y Álgebra",
      "item_range": [
        51,
        75
      ],
      "total_items": 25
    },
    {
      "id": "statistics",
      "name": "Estadística y Probabilidad",
      "item_range": [
        76,
        87
      ],
      "total_items": 12,
      "distribution": {
        "A1": 4,
        "A2": 4,
        "A3": 4
      }
    }
  ],
  "notes": [
    "spec.affirmation_desc está vacío (null) para Geometría y Relaciones y Álgebra: la Tabla de especificaciones (PDF escaneado, sin capa de texto) no pudo digitalizarse; debe completarse a partir de dicho documento.",
    "Los códigos de evidencia se normalizaron al formato A<n>.<m> (p. ej., A1-E5 -> A1.5) para unificar Estadística con Geometría/Funciones.",
    "El campo topic corresponde al nivel 'Conocimiento' de la Tabla de especificaciones.",
    "La convención de flechas en los ejes difiere entre secciones: las figuras de Funciones declaran axes.arrows=true mientras que las de Geometría no lo declaraban; debe unificarse."
  ],
  "items": [
    {
      "id": 1,
      "area": "Geometría",
      "area_id": "geometry",
      "topic": "Circunferencia",
      "spec": {
        "block": "1. Geometría",
        "affirmation": "A1",
        "affirmation_desc": null,
        "evidence": "A1.2",
        "evidence_desc": "Reconoce la representación algebraica de una circunferencia dado su centro y su radio, en diversos contextos."
      },
      "options": {
        "A": "$(x+2)^2 + (y+3)^2 = 25$",
        "B": "$(x-2)^2 + (y-3)^2 = 25$",
        "C": "$(x+3)^2 + (y-2)^2 = 25$",
        "D": "$(x-3)^2 + (y-2)^2 = 25$"
      },
      "correct_answer": "B",
      "solution_steps": [
        "La ecuación ordinaria de una circunferencia con centro $(h,k)$ y radio $r$ es $(x-h)^2 + (y-k)^2 = r^2$.",
        "Sustituyendo $h=2$, $k=3$, $r=5$: $(x-2)^2 + (y-3)^2 = 25$.",
        "Por lo tanto, la opción correcta es B."
      ],
      "group_id": null,
      "visual_spec": null,
      "set_id": "set_1",
      "statement": "Si la medida del radio de la circunferencia “c” es $5$ y su centro es $(2, 3)$",
      "problem": "la ecuación de “c” corresponde a"
    },
    {
      "id": 2,
      "area": "Geometría",
      "area_id": "geometry",
      "topic": "Circunferencia",
      "spec": {
        "block": "1. Geometría",
        "affirmation": "A1",
        "affirmation_desc": null,
        "evidence": "A1.3",
        "evidence_desc": "Resuelve problemas, de diversos contextos, relacionados con la circunferencia y sus representaciones."
      },
      "options": {
        "A": "$(x-5)^2 + (y+4)^2 = 400$",
        "B": "$(x+5)^2 + (y-4)^2 = 400$",
        "C": "$(x-5)^2 + (y-4)^2 = 400$",
        "D": "$(x+5)^2 + (y+4)^2 = 400$"
      },
      "correct_answer": "A",
      "solution_steps": [
        "El centro de la circunferencia es $(5, -4)$ porque está $5\\text{ km}$ al este y $4\\text{ km}$ al sur.",
        "El radio es $20\\text{ km}$, por lo que $r^2 = 400$.",
        "La ecuación es $(x-5)^2 + (y+4)^2 = 400$.",
        "Opción correcta: A."
      ],
      "group_id": null,
      "visual_spec": null,
      "set_id": "set_1",
      "statement": "Una torre de control de un aeropuerto tiene un radar con un alcance máximo de $20\\text{ km}$. Tomando como origen la pista principal del aeropuerto, la torre de control se ubica $5\\text{ km}$ al este (eje $x$ positivo) y $4\\text{ km}$ al sur (eje $y$ negativo) de dicha pista.",
      "problem": "¿Cuál es la ecuación que representa el alcance máximo del radar de la torre de control?"
    },
    {
      "id": 3,
      "area": "Geometría",
      "area_id": "geometry",
      "topic": "Circunferencia",
      "spec": {
        "block": "1. Geometría",
        "affirmation": "A1",
        "affirmation_desc": null,
        "evidence": "A1.1",
        "evidence_desc": "Reconoce la representación gráfica de una circunferencia dado su centro y su radio, en diversos contextos."
      },
      "options": {
        "A": "$x^2 + (y - 2)^2 = 6$",
        "B": "$x^2 + (y + 2)^2 = 9$",
        "C": "$x^2 + (y - 2)^2 = 9$",
        "D": "$x^2 + (y + 2)^2 = 6$"
      },
      "correct_answer": "C",
      "solution_steps": [
        "Del gráfico, el centro $O$ está en $(0, 2)$.",
        "El radio es la distancia del centro a un punto de la circunferencia, por ejemplo $(0,5)$: $r = 3$.",
        "La ecuación es $(x-0)^2 + (y-2)^2 = 3^2$, es decir, $x^2 + (y-2)^2 = 9$.",
        "Opción correcta: C."
      ],
      "group_id": null,
      "visual_spec": {
        "alt": "Circunferencia con centro en (0, 2) y radio 3 en un plano cartesiano.",
        "visual": {
          "type": "cartesian_2d",
          "domain": {
            "x": [
              -6,
              6
            ],
            "y": [
              -2,
              6
            ]
          },
          "grid": false,
          "children": [
            {
              "type": "circle",
              "center": [
                0,
                2
              ],
              "radius": 3,
              "label": "c"
            },
            {
              "type": "point",
              "coords": [
                0,
                2
              ],
              "label": "O"
            },
            {
              "type": "point",
              "coords": [
                0,
                5
              ],
              "label": "5"
            },
            {
              "type": "dashed_projection",
              "from": [
                0,
                5
              ],
              "to_axis": "y"
            },
            {
              "type": "point",
              "coords": [
                0,
                -1
              ],
              "label": "-1"
            },
            {
              "type": "dashed_projection",
              "from": [
                0,
                -1
              ],
              "to_axis": "y"
            }
          ]
        }
      },
      "set_id": "set_1",
      "statement": "Considere la siguiente representación gráfica de la circunferencia “c”, de centro “O”:",
      "problem": "De acuerdo con la información dada la ecuación de “c” corresponde a"
    },
    {
      "id": 4,
      "area": "Geometría",
      "area_id": "geometry",
      "topic": "Circunferencia",
      "spec": {
        "block": "1. Geometría",
        "affirmation": "A1",
        "affirmation_desc": null,
        "evidence": "A1.3",
        "evidence_desc": "Resuelve problemas, de diversos contextos, relacionados con la circunferencia y sus representaciones."
      },
      "options": {
        "A": "$7\\text{ m}$",
        "B": "$14\\text{ m}$",
        "C": "$49\\text{ m}$",
        "D": "$98\\text{ m}$"
      },
      "correct_answer": "A",
      "solution_steps": [
        "La ecuación dada está en forma ordinaria: $(x+2)^2 + (y-7)^2 = 49$.",
        "El radio al cuadrado es $49$, por lo tanto el radio es $7$.",
        "El alcance máximo es el radio: $7\\text{ m}$.",
        "Opción correcta: A."
      ],
      "group_id": null,
      "visual_spec": null,
      "set_id": "set_1",
      "statement": "Un faro de luz direccional emite una señal que cubre una zona circular en el mar. El borde de la zona iluminada está delimitado por la circunferencia “c” dada por la ecuación $(x + 2)^2 + (y - 7)^2 = 49$.",
      "problem": "¿Cuál es el alcance máximo del haz de luz del faro?"
    },
    {
      "id": 5,
      "area": "Geometría",
      "area_id": "geometry",
      "topic": "Traslación de circunferencia",
      "spec": {
        "block": "1. Geometría",
        "affirmation": "A2",
        "affirmation_desc": null,
        "evidence": "A2.1",
        "evidence_desc": "Reconoce la representación gráfica o algebraica de la traslación de una circunferencia en diversos contextos."
      },
      "options": {
        "A": "$(x+1)^2 + (y-3)^2 = 9$",
        "B": "$(x-1)^2 + (y-3)^2 = 9$",
        "C": "$(x+1)^2 + (y+3)^2 = 9$",
        "D": "$(x-1)^2 + (y+3)^2 = 9$"
      },
      "correct_answer": "C",
      "solution_steps": [
        "Del gráfico, la circunferencia $d$ tiene centro en $(4,0)$ y radio $3$ (pues pasa por $(4,3)$ y $(4,-3)$).",
        "Trasladar $5$ unidades a la izquierda: $x' = x - 5$; $3$ unidades hacia abajo: $y' = y - 3$.",
        "El nuevo centro es $(4-5, 0-3) = (-1, -3)$.",
        "La ecuación resultante es $(x+1)^2 + (y+3)^2 = 9$.",
        "Opción correcta: C."
      ],
      "group_id": null,
      "visual_spec": {
        "alt": "Circunferencia con centro en (4, 0) y radio 3 en un plano cartesiano.",
        "visual": {
          "type": "cartesian_2d",
          "domain": {
            "x": [
              -2,
              8
            ],
            "y": [
              -5,
              5
            ]
          },
          "grid": false,
          "children": [
            {
              "type": "circle",
              "center": [
                4,
                0
              ],
              "radius": 3,
              "label": "d"
            },
            {
              "type": "point",
              "coords": [
                4,
                0
              ],
              "label": "O"
            },
            {
              "type": "point",
              "coords": [
                4,
                3
              ],
              "label": "3"
            },
            {
              "type": "dashed_projection",